"article_id","prod_name","product_type_name","product_group_name","graphical_appearance_name","colour_group_name","garment_group_name","detail_desc"
"0807506001","ELLE strawbag","Bag","Accessories","Embroidery","Light Beige","Accessories","Shopper in braided paper straw containing glittery threads. Embroidered motif on the front and two handles at the top with decorative tassels in neon colours. Contrasting colour lining. Depth 9.5 cm. Height 28 cm. Width 38 cm."
"0698882006","Emma Basic Low BG","Sneakers","Shoes","Solid","Black","Shoes","Cotton canvas trainers with lacing at the front and a loop at the back. Canvas linings and insoles and fluted rubber soles."
"0839891002","LOGG Sydney Linen Dress","Dress","Garment Full body","Solid","Beige","Blouses","Knee-length shirt dress in a linen and cotton weave with a collar, buttons down the front and a yoke with a pleat at the back. Flap chest pockets, 3/4-length sleeves with buttoned cuffs, a detachable tie belt at the waist, and slits in the sides. Unlined."
"0601126001","AMALIE bib dress","Dress","Garment Full body","Solid","Light Beige","Woven/Jersey/Knitted mix Baby","Baby Exclusive. Skirt in a textured organic cotton weave with an elasticated waist and adjustable straps that cross at the back."
"0817115001","Geneva top","Top","Garment Upper body","Solid","Off White","Jersey Fancy","Top in jersey with a small, draped stand-up collar and an opening with a button at the back of the neck. Short cap sleeves and a straight hem. Unlined."
"0574801003","Ben fleece overall","Outdoor overall","Garment Full body","All over pattern","Green","Outdoor","All-in-one suit in soft, thermal fleece with an all-over print, stand-up collar, zip down the front and raglan sleeves."
"0834988001","Bag Albin colour block bumbag","Bag","Accessories","Colour blocking","Dark Beige","Accessories","Small oval waist bag in a sturdy weave with an appliqué on the front, zip at the top and a zipped outer compartment. Adjustable waist belt with a metal fastener. Size approx. 3.5x12x19.5 cm."
"0900679001","Paradiset set.","Shorts","Garment Lower body","All over pattern","Dark Blue","Trousers","Set with a sleeveless top and pair of shorts in an airy, viscose weave. Top with a round neckline, opening with a button at the back of the neck and tie-detail at the front hem. Shorts with wide elastication at the waist and side pockets."
"0759409001","Blake Chelsea BG","Boots","Shoes","Solid","Black","Shoes","Chelsea boots in imitation leather with elastic gores in the sides and loops at the top. Fleece linings and insoles and chunky soles. Heel approx. 2 cm."
"0701695003","SKI MITTEN LONG.","Gloves","Accessories","All over pattern","Dark Blue","Accessories","Ski mittens in windproof, water-repellent, functional fabric with folded seams, elastication at the wrists and top and reflective details. Plastic hook-and-eye fastening to keep the gloves together. Thinsulate™ lining. The mittens have a water-repellent coating without fluorocarbons."
"0772373001","SKINNY CHEAPO HOOK 79","Trousers","Garment Lower body","Denim","Blue","Trousers Denim","Slim-fit jeans in washed, stretch denim with an adjustable elasticated waist, zip fly and button, front and back pockets, and narrow hems."
"0811907001","Sporty spice top","Bikini top","Swimwear","Other structure","Other Green","Swimwear","Fully lined bikini top with removable inserts that shape the bust and provide good support. Narrow, adjustable shoulder straps and covered elastication at the hem. No fasteners."
"0871376002","Kanye HW satin Trs","Trousers","Garment Lower body","Solid","Black","Trousers","Trousers in satin with a high waist that has covered elastication and loops, one with a decorative D-ring. Diagonal side pockets, flap leg pockets with a tab and D-ring and long, tapered legs with covered elastication at the hems."
"0733454001","Basic Girly Rib Leggings","Leggings/Tights","Garment Lower body","Solid","Light Pink","Jersey Basic","Leggings in ribbed organic cotton jersey with an elasticated waist and overlocked hems."
"0739590002","Timeles Cheeky Brief","Swimwear bottom","Swimwear","Solid","Black","Swimwear","Fully lined bikini bottoms with a low waist and cutaway coverage at the back."
"0750347001","&DENIM Shaping HW ancle patche","Trousers","Garment Lower body","Denim","Blue","Trousers Denim","5-pocket, ankle-length jeans in washed denim with technical stretch that holds in and shapes the waist, thighs and bum while keeping the jeans in shape. High waist, zip fly and button and skinny legs."
"0630777017","Rich Tee","T-shirt","Garment Upper body","Embroidery","Black","Jersey Fancy","Straight-style T-shirt in soft cotton jersey with ribbing around the neckline."
"0866468001","+ Tyra Shape Highwaist","Swimwear bottom","Swimwear","Solid","Dark Blue","Swimwear","Fully lined bikini bottoms with a sculpting effect on the waist. High, V-shaped waist and medium coverage at the back."
"0785889001","Beanie Kaj Cable","Beanie","Accessories","Melange","Black","Accessories","Hat in a soft cable knit with a wide ribbed hem."
"0651306001","EVA","Sweater","Garment Upper body","Melange","Light Beige","Knitwear","Jumper in a soft, textured knit with long sleeves and ribbing around the neckline, cuffs and hem."
"0544918002","Richie Cardigan","Cardigan","Garment Upper body","Solid","Greenish Khaki","Jersey Fancy","Cardigan in lightweight sweatshirt fabric with a lined hood, draped lapels and detachable tie belt at the waist. Side pockets, roll edges and an asymmetric hem that is longer at the front."
"0840061002","Menorca linen dress","Dress","Garment Full body","Solid","Light Orange","Dresses Ladies","Short dress in a soft linen and viscose weave with a collar, V-neck and buttons down the front. Short sleeves and a tapered waist with a detachable tie belt. Unlined."
"0522678003","Art leather sneaker PQ","Sneakers","Shoes","Solid","White","Shoes","Trainers with lacing at the front, leather linings and insoles and rubber soles."
"0489217006","Carolina Boot","Boots","Shoes","Solid","Dark Red","Shoes","Ankle boots in imitation suede with lacing at the front, a loop at the back, pile linings and insoles and chunky rubber soles. Heel 3.5 cm."
"0802490002","The Highline high waist","Swimwear bottom","Swimwear","All over pattern","Dark Grey","Swimwear","Fully lined, waist-high bikini bottoms with a high cut at the back."
"0903090001","Beamer dress","Dress","Garment Full body","Solid","Light Yellow","Blouses","Fitted, knee-length cold shoulder dress in a Tencel™ lyocell weave with narrow, adjustable shoulder straps that cross at the back. Wide, double-layered flounce with covered elastication at the top that continues over the sleeves. Short, cotton-lined puff sleeves with concealed elastication for added volume. Concealed zip in one side and a slit at the back. Lined at the top."
"0821771002","Brenda DEAL set","Shorts","Garment Lower body","Front print","Black","Jersey Fancy","Set with a T-shirt in cotton jersey and pair of shorts in sweatshirt fabric made from a cotton blend. Printed T-shirt with a round neckline and rounded hem. Shorts with elasticated ribbing and a drawstring at the waist, text print and rounded hems."
"0876125001","Twist jumpsuit","Jumpsuit/Playsuit","Garment Full body","Solid","Black","Dresses Ladies","Ankle-length jumpsuit in jersey with a V-neck and twisted detail with a draped effect and cut-out section at the top. Narrow, adjustable shoulder straps, a seam at the waist and wide, straight legs. Unlined."
"0518091001","Alva padded 2pk","Bra","Underwear","Melange","Dark Grey","Under-, Nightwear","Soft nursing bras in organic cotton jersey with lightly padded, opening cups with space for nursing pads. Slightly wider adjustable shoulder straps and a fastening at the back with three pairs of hooks and eyes."
"0780719001","Premium Animal softie","Slippers","Shoes","Solid","Beige","Shoes","Suede slippers with embroidery and a print motif on the front and elastication around the top. Pile linings and insoles and soft soles."
"0633960005","Lipbalm Lisa","Fine cosmetics","Cosmetic","Solid","Light Green","Accessories","Moisturising lip balm in a plastic pot with a lid. 3.7 g."
"0648935001","Velma maxi dress","Dress","Garment Full body","Solid","Black","Dresses Ladies","Jersey maxi dress with a low-cut back with crossover straps, short cap sleeves, an elasticated seam at the waist and slits in the sides."
"0854004003","Siberian jacket","Jacket","Garment Upper body","Solid","Light Beige","Outdoor","Boxy jacket in wide-wale cotton corduroy with a collar, large buttons at the front, patch pockets with a flap and button and a concealed side pocket at the front. Dropped shoulders and straight sleeves with adjustable tabs and buttons at the cuffs. Unlined."
"0697493002","PE RUTH CASHMERE TOP","Top","Garment Upper body","Solid","Off White","Unknown","Fitted polo-neck jumper in airy, fine-knit wool containing some cashmere with long sleeves and raw edges at the cuffs and hem."
"0734305002","Hunter SPEED","Trousers","Garment Lower body","Solid","Black","Trousers","Joggers in cotton twill with a regular, elasticated drawstring waist, fake fly, side pockets, welt back pockets with a button and tapered legs with elasticated hems."
"0499959002","JULEE FUR SCARF","Scarf","Accessories","Solid","Black","Accessories","Tube scarf in soft faux fur. Width 25 cm, circumference 70 cm."
"0588573003","Aberdeen","Trousers","Garment Lower body","Solid","Greenish Khaki","Trousers","Pull-on trousers in cotton twill with an elasticated drawstring waist, side pockets and one back pocket. Tapered legs with decorative seams at the knees and ribbed hems."
"0708394002","MARY LS","Top","Garment Upper body","Solid","Light Pink","Jersey Fancy","Fitted, off-the-shoulder top in soft jersey made from a viscose blend with a V-neck front and back and long sleeves."
"0790288001","Cozy tutu dress","Dress","Garment Full body","Placement print","Dark Pink","Jersey Fancy","Dress in soft sweatshirt fabric with a press-stud on one shoulder, long raglan sleeves and a lined, glittery tulle skirt."
"0564485008","Alison","Cardigan","Garment Upper body","Solid","Dark Red","Knitwear","Cardigan in a soft knit with a shawl collar, dropped shoulders and no buttons."
"0737777001","Gainsbourg Coat","Coat","Garment Upper body","Check","Light Beige","Outdoor","Knee-length, straight-cut coat in woven fabric with notch lapels, concealed press-studs down the front and welt front pockets. Unlined."
"0841668002","Flirty Louise necklace","Necklace","Accessories","Solid","Gold","Accessories","Short thin metal chain necklace with round pendants in hammered metal. Adjustable length 41-48 cm."
"0402065038","OSCAR l/s tee SB","T-shirt","Garment Upper body","Stripe","Dark Blue","Jersey Basic","Long-sleeved top in organic cotton jersey with a ribbed neckline and a chest pocket."
"0831714001","Jessie PU Shorts","Shorts","Garment Lower body","Treatment","Black","Shorts","High-waisted shorts in imitation leather with pleats at the top and wide belt loops at the waist. Zip fly with a concealed hook-and-eye fastener, side pockets, a fake back pocket and sewn-in turn-ups at the hems. Soft, lightly brushed inside.."
"0453745011","ASHTON","Dress","Garment Full body","All over pattern","Dark Blue","Jersey Basic","Dress in soft jersey made from a cotton blend with long sleeves, a seam at the waist and flared skirt."
"0598806001","Dixie tee","T-shirt","Garment Upper body","Stripe","White","Jersey Fancy","Short top in soft cotton jersey with short sleeves. Contrasting colour trims around the neckline and sleeves."
"0549148010","Csp lavender","Top","Garment Upper body","Application/3D","Grey","Jersey Fancy","T-shirt in soft jersey with embroidered appliqués."
"0857661001","Kendrick sleevles hood","Top","Garment Upper body","Solid","Black","Outdoor","Sleeveless hoodie in fast-drying functional fabric with a mesh-lined, drawstring hood and yoke at the back. Small print motif on the front, a kangaroo pocket and short slits in the sides."
"0811600001","Hallie Lace Dress","Dress","Garment Full body","Lace","Light Blue","Dresses Ladies","Short dress in lace with a small, pompom trimmed stand-up collar, an opening with a button at the back of the neck and long trumpet sleeves. Seam at the waist with a lace trim, a concealed zip in one side, and raw, scalloped edges at the cuffs and hem. Partly lined in jersey."
"0579695001","Swift jumper","Sweater","Garment Upper body","Solid","Dark Red","Jersey Fancy","Jumper in a soft, fine knit with a deep V-neck at the back and ties at the back of the neck. Long sleeves with lace-trimmed asymmetric cuffs, slits in the sides and a lace trim at the hem."
"0627267002","Corina fancy poncho","Other accessories","Accessories","Solid","Light Orange","Swimwear","Open poncho in an airy viscose weave with inset lace embroidery, a drawstring at the waist and slits in the sides."
"0694344003","Jackie brazillian","Underwear bottom","Underwear","Solid","Light Orange","Under-, Nightwear","Shaping Brazilian briefs in microfibre and lace with a high waist, lined gusset and half-string back. The briefs have a light shaping effect on the tummy and hips."
"0688966001","Two Sherling Jacket","Jacket","Garment Upper body","Solid","Black","Unknown","Straight-cut jacket in soft imitation leather with a faux fur-lined collar, zip down the front and welt front pockets. Faux fur lining."
"0607252001","Bubble","Sweater","Garment Upper body","Melange","Grey","Knitwear","Wide-fitting jumper in a chunky-knit wool blend containing some alpaca wool. Low dropped shoulders, long, wide puff sleeves, and ribbing around the neckline, cuffs and hem."
"0873003001","HM+ Virgil linen shirt.","Shirt","Garment Upper body","Solid","White","Blouses","Shirt in an airy linen weave with a turn-down collar, buttons down the front and a yoke with a pleat at the back. Long sleeves with buttoned cuffs, and a gently rounded hem."
"0867357001","Stunning dress","Dress","Garment Full body","Solid","Black","Jersey Fancy","Calf-length dress in jersey crêpe with a square neckline and long puff sleeves. Gathers at one side to create a draped effect, and a wrapover skirt with a slit at the front. Lined front."
"0738044001","Japan top","Sweater","Garment Upper body","Solid","Dark Yellow","Knitwear","Long-sleeved top in a soft rib knit containing some wool with a V-neck, wrapover front and knitted tie belt at the waist. The polyester content of the top is recycled."
"0793185002","Petra 2p bandana","Hair/alice band","Accessories","All over pattern","Dark Blue","Accessories","Scarves in patterned satin that can also be tied as a hairband. Size 30x80 cm."
"0803597001","ED Spirit","Sweater","Garment Upper body","Solid","White","Knitwear","Off-the-shoulder jumper in a soft, fluffy knit with a wide foldover top edge, long raglan sleeves and ribbing at the cuffs and hem."
"0759951002","Enzo bikini top","Bikini top","Swimwear","Solid","Red","Jersey Fancy","Bandeau bikini top in smocked fabric with ties at the back of the neck and no fasteners."
"0898598007","Kibble shorts .","Shorts","Garment Lower body","All over pattern","Black","Jersey Fancy","Shorts in soft cotton jersey with elastication and a decorative bow at the waist, and front pockets."
"0897912002","Snape 2PCS set","Garment Set","Garment Full body","Placement print","Black","Jersey Fancy","Set with a long-sleeved top and pair of trousers in soft cotton jersey. Top with a press-stud on one shoulder (except in sizes 1½-4Y) and ribbing around the neckline. Trousers with covered elastication at the waist."
"0602716001","PEACH","Blouse","Garment Upper body","Stripe","Light Blue","Blouses","Off-the-shoulder blouse in an airy cotton weave with elastication and a wide flounce at the top."
"0405310005","Ciara sunglasses","Sunglasses","Accessories","Solid","Black","Accessories","Sunglasses with plastic and metal frames and tinted, UV-protective lenses."
"0550888009","Chris Cargo (1) (1)","Trousers","Garment Lower body","Solid","Dark Blue","Trousers","Stretch cotton twill cargo joggers in a relaxed fit with a zip fly and button and slightly lower crotch. Side pockets, back pockets and leg pockets with a flap and press-stud, and tapered legs with elasticated hems."
"0772193001","Class Pelle hoop pk","Earring","Accessories","Solid","Gold","Accessories","Metal hoop earrings in various designs. Diameter from 1.5 cm to 2 cm."
"0734287002","Fusili","Blouse","Garment Upper body","Solid","White","Blouses","Sleeveless blouse in a viscose crêpe weave with a V-neck, covered buttons down the front and a yoke with decorative gathers at the shoulders and back. Rounded hem, longer at the back."
"0796599001","PARTY Pearl dress","Dress","Garment Full body","Sequin","Light Beige","Dresses Ladies","Short, fitted dress in mesh with sequined embroidery on the front. Deep V-neck with decorative lacing at the top, an opening at the back with a hook-and-eye fastening at the back of the neck, and a concealed zip at the back. Long sleeves with sequined embroidery at the cuffs. Partly lined."
"0816657001","Tom tom skirt","Skirt","Garment Lower body","Solid","White","Trousers","Calf-length skirt woven in a soft modal blend with a high drawstring waist, an adjustable tab with press-studs at the sides and large patch front pockets with a decorative flap. Zip fly and press-studs, and a high slit front and back. Lined."
"0720752003","Nina saddle bag","Bag","Accessories","Other pattern","Beige","Accessories","Saddle bag in snakeskin-patterned imitation leather with a handle and detachable, adjustable shoulder strap with carabiner hooks. Flap with a metal fastener, and one inner compartment. Unlined. Size 10x21x25 cm."
"0650790002","S.U Nanna Cardigan(1)","Cardigan","Garment Upper body","Solid","Dark Blue","Special Offers","Cardigan in soft, fine-knit cotton with long sleeves, buttons down the front and short slits in the sides. Ribbing around the neckline, cuffs and hem."
"0521302006","Make the boys wink","Sweater","Garment Upper body","Melange","Green","Knitwear","Wide jumper in a soft rib knit containing some wool with low dropped shoulders, long sleeves and ribbing around the neckline, cuffs and hem."
"0883002002","STAR v-neck merino","Sweater","Garment Upper body","Melange","Dark Blue","Knitwear","Classic V-neck jumper in fine-knit merino wool with long sleeves and ribbing around the neckline, cuffs and hem."
"0776724003","D2 PE KHARMA SATIN","Shirt","Garment Upper body","Solid","Dark Pink","Unknown","Blouse in softly draping silk with a high collar and concealed zip at the back. Long sleeves with a high slit and covered buttons at the cuffs, and a straight-cut hem."
"0664715002","Cable tights","Underwear Tights","Socks & Tights","Solid","Light Pink","Socks and Tights","Tights in a soft, cable-knit cotton blend with an elasticated waist."
"0747432006","BETH PRICE SWETTIS","Sweater","Garment Upper body","Front print","Yellow","Jersey Fancy","Top in soft sweatshirt fabric with a print motif, dropped shoulders, long sleeves and ribbing around the neckline, cuffs and hem. Soft brushed inside."
"0779249001","Basic rib shorts","Shorts","Garment Lower body","Solid","Light Pink","Jersey Basic","Shorts in soft, ribbed organic cotton jersey with an elasticated waist and overlocked hems."
"0653221002","Amadore tee","T-shirt","Garment Upper body","Solid","Yellow","Unknown","Round-necked T-shirt in cotton jersey with a decorative seam at the top."
"0595311002","Kiwi top SW BIG","Bikini top","Swimwear","Solid","White","Swimwear","Fully lined bikini top with removable inserts and a concealed plastic ring at the front. Narrow adjustable shoulder straps and a metal fastening at the back."
"0892850001","Malva dress","Dress","Garment Full body","Solid","Dark Red","Dresses Ladies","Sleeveless, knee-length dress in woven fabric with a collar and a V-neck opening with a concealed button at the front. Seam at the waist and a belt with metal D-rings. Unlined."
"0375585001","Sigge shorts","Trousers","Garment Lower body","Melange","Grey","Jersey Basic","Shorts in sweatshirt fabric with an elasticated drawstring waist, side pockets, one back pocket and raw-edge hems."
"0510968001","Alisa Midi Skirt","Skirt","Garment Lower body","Solid","Light Turquoise","Trousers","Lace skirt with an elasticated waist. Lined."
"0550384002","Valerie Lace top","Blouse","Garment Upper body","Solid","Red","Blouses","Top in a viscose crêpe blend with lace trims. Narrow shoulder straps, V-neck at the front and short slits in the sides."
"0676283001","Caruso satchel","Bag","Accessories","Solid","Black","Accessories","Shoulder bag in grained imitation leather with a flap with a metal fastener, narrow, detachable shoulder strap and an inner tab with press-studs. One open inner compartment and one zipped compartment. Lined. Size approx. 5x21x33 cm."
"0536656001","Elite","Blazer","Garment Upper body","Solid","Black","Dressed","Jacket in woven fabric with a wrapover front with a concealed fastening on the inside and tab with a metal fastener at one side. Welt front pockets with a flap, a slit at the cuffs and a single back vent. Lined."
"0595440008","Mike 2-p s/l pj BB","Pyjama set","Nightwear","Stripe","Light Green","Under-, Nightwear","Pyjamas in soft cotton jersey. T-shirt top with a print motif. Shorts with an elasticated waist."
"0849586004","Kristin dress","Dress","Garment Full body","All over pattern","Off White","Jersey Fancy","Calf-length dress in stretch, patterned mesh. Draped bodice with pleats at the sides, a seam at the waist and raw edges at the cuffs and hem. Jersey-lined bodice and jersey underskirt."
"0743730003","Reef s/s tee","T-shirt","Garment Upper body","Front print","Dark Blue","Jersey Fancy","T-shirt in printed cotton jersey with a round, ribbed neckline."
"0645699001","Finlandia Culotte","Trousers","Garment Lower body","Stripe","Blue","Trousers","Striped, 3/4-length trousers in a cotton and linen weave with an elasticated drawstring waist, side pockets and straight, wide legs."
"0696128001","W AERO DRESS CNY","Dress","Garment Full body","Solid","Red","Unknown","Short dress in a crêpe weave with a stand-up collar, an opening with covered buttons at the back of the neck and long sleeves with covered buttons at the cuffs. Narrow elasticated seam at the waist and a skirt with a sewn-in wrapover and flounced trim. Unlined."
"0654263005","Leyla pants","Trousers","Garment Lower body","Melange","Grey","Jersey Fancy","Marled joggers in a soft, fine-knit viscose blend with an elasticated drawstring waist, side pockets and ribbed hems. Wide waistband for a more comfortable fit."
"0806388018","Therese tee","T-shirt","Garment Upper body","Solid","Purple","Jersey Basic","Wide T-shirt in soft cotton jersey with a ribbed neckline."
"0658601005","TP Daniel 3-p boxer SB","Underwear bottom","Underwear","Solid","Black","Under-, Nightwear","Boxer shorts in cotton jersey with short legs, an elasticated waist and lined front."
"0874027001","Josh set","Shirt","Garment Upper body","All over pattern","Light Blue","Shirts","Set with a short-sleeved shirt and pair of shorts in a cotton weave. Shirt with a collar, buttons down the front and a gently rounded hem. Shorts with an elasticated, drawstring waist, fake fly, side pockets and a back pocket."
"0633814002","Lilly","Dress","Garment Full body","All over pattern","Light Beige","Dresses Ladies","Knee-length dress in a patterned weave with dropped shoulders, short flounced sleeves and a detachable tie belt at the waist. Concealed zip and  a hook-and-eye fastener at the back, wide skirt with a sewn-in wrapover and decorative flounce and a seam and wide flounce at the hem. Unlined."
"0737598001","CE Opal dress","Dress","Garment Full body","Solid","Light Red","Special Offers","CONSCIOUS EXCLUSIVE. Maxi dress in crinkled chiffon and recycled polyester with a deep V-neck at the front and a halterneck that fastens with long, wide ties at the back. Concealed zip in one side, asymmetric seams at the waist and a wide, heavily draping voluminous skirt. The skirt has vertical flounces for width and movement, a high slit at the front and a seam and wide flounce at the hem. Recycled polyester lining."
"0575156013","FREJA 3-PACK","T-shirt","Garment Upper body","Solid","Dark Blue","Jersey Basic","Long-sleeved tops in soft organic cotton jersey."
"0824646001","JIMMY SHORTS","Shorts","Garment Lower body","All over pattern","Grey","Jersey Fancy","Shorts in soft cotton jersey with an elasticated, drawstring waist and side pockets."
"0684021084","Wow printed tee 6.99","T-shirt","Garment Upper body","Placement print","Light Grey","Jersey Fancy","T-shirt in soft cotton jersey with a round neckline and a print motif."
"0740512002","JANET blanket scarf","Scarf","Accessories","Check","Dark Grey","Accessories","Large scarf in a soft weave with fringes on the short sides."
"0602673025","BIGGIE bomber","Jacket","Garment Upper body","Solid","Dark Grey","Outdoor","Bomber jacket in woven fabric with a ribbed stand-up collar and zip down the front. Zipped chest pocket, pockets in the side seams, an inner pocket with a press-stud, and ribbing at the cuffs and hem. Lined."
"0859743006","Coachella brazilian 2p","Underwear bottom","Underwear","Solid","Light Pink","Under-, Nightwear","Brazilian briefs in lace with a V-shaped, mid waist, lined gusset and high cut at the back."
"0608013008","Moto ISW19","Dress","Garment Full body","Solid","Light Yellow","Dresses Ladies","Long bandeau dress in an airy weave with draping and a silicone trim at the top and support panels in the bodice. Detachable, adjustable shoulder straps and a concealed zip at the back. Lined."
"0930285001","Chip Sweater 14.99:-","Sweater","Garment Upper body","Placement print","Grey","Jersey Fancy","Long-sleeved top in soft cotton sweatshirt fabric with a text print front and back and ribbing around the neckline, cuffs and hem. Soft brushed inside."
