"article_id","prod_name","product_type_name","product_group_name","graphical_appearance_name","colour_group_name","garment_group_name","detail_desc"
"0739680002","Mia L/S Tee","Top","Garment Upper body","Placement print","Dark Blue","Jersey Fancy","Long-sleeved top in soft cotton jersey with a round neck. Slightly longer at the back."
"0924650001","Mini-me Cotton Tail","Jacket","Garment Upper body","Solid","Light Beige","Outdoor","Jacket in soft faux shearling with a stand-up collar, yoke at the back and zip down the front. Dropped shoulders, diagonal jetted chest pockets, discreet pockets in the side seams and a trimmed hem."
"0802598005","PQ VALENTINA JUMPER","Sweater","Garment Upper body","Solid","Light Pink","Knitwear","Fitted jumper in soft, fine-knit, ribbed cashmere with 3/4-length sleeves and ribbing around the neckline."
"0637305005","MILAD fleece jkt","Jacket","Garment Upper body","All over pattern","Light Turquoise","Outdoor","Jacket in patterned, thermal fleece with a stand-up collar and zip with a chin guard at the front."
"0890175002","5-P Mia","T-shirt","Garment Upper body","All over pattern","Red","Jersey Fancy","Long-sleeved tops in soft cotton jersey with a round neckline."
"0549708004","Amanda jumper","Sweater","Garment Upper body","Solid","Light Pink","Jersey Fancy","Jumper in a soft viscose-blend knit with a V-neck and inset lace section at the back. Long sleeves with a wide lace edge at the end."
"0626263002","GILDA LEGGINGS","Leggings/Tights","Garment Lower body","Solid","Grey","Jersey Fancy","Treggings in stretch, denim-look jersey with an elasticated waist, fake fly, fake front pockets and real back pockets."
"0845967003","DIV Isafie","Cardigan","Garment Upper body","Solid","White","Unknown","Cardigan in a soft, loose, textured knit with 3/4-length sleeves with sewn-in turn-ups. No buttons."
"0761490001","Nasa Camp Tee","T-shirt","Garment Upper body","Front print","Black","Jersey Fancy","T-shirt in printed cotton jersey."
"0700861001","Mitchell top","Top","Garment Upper body","Solid","Dark Blue","Jersey Fancy","Long, pleated top in jersey with a sheen, with long sleeves and overlocked edges at the cuffs and hem."
"0630675002","6p Claw","Hair clip","Accessories","Solid","Light Beige","Accessories","Hair clips in coloured plastic."
"0903824003","Neroli sweater","Sweater","Garment Upper body","Other structure","Red","Knitwear","Jumper knitted in soft chenille yarn with long puff sleeves and ribbing around the neckline, cuffs and hem."
"0875915001","Addison top","T-shirt","Garment Upper body","All over pattern","Yellow","Jersey Fancy","Long-sleeved top in soft, patterned cotton jersey with a frill-trimmed yoke at the front and a small opening and button at the back of the neck."
"0623277001","SCAR Tulle Dress","Dress","Garment Full body","Glittering/Metallic","Light Pink","Dresses/Skirts girls","Gently flared dress in glittery tulle with an opening and button at the back of the neck, gathers at the top and short, butterfly sleeves. Satin lining."
"0828863001","Olive dress","Dress","Garment Full body","All over pattern","Light Pink","Jersey Fancy","Dress in textured jersey made from a cotton blend with a round neck and small opening with a button at the back of the neck. Short sleeves with a decorative flounce around the seams. Unlined."
"0789808002","Skylar Chunky Sweater","Sweater","Garment Upper body","Melange","Grey","Knitwear","Short jumper in a soft rib knit with low dropped shoulders and long sleeves."
"0818806002","OL Dog quilted coat","Other accessories","Accessories","Solid","Black","Accessories","Quilted jacket for a dog in woven fabric with a collar and opening for a leash at the back of the neck. Opening for the front legs and an adjustable hook and loop tab that fastens at the top. Narrow elastic straps for the back legs that help to keep the jacket in place. Lined."
"0852092001","SPEED 2 AVA BLOUSE","Blouse","Garment Upper body","Solid","Black","Blouses","Blouse in satin with a square neckline, seam under the bust and pleated section at the front. Smocking at the back, and 3/4-length sleeves with elastication at the top and an elasticated seam, smocking and a frill trim at the cuffs. Lined front."
"0769801003","Fralla Top","Vest top","Garment Upper body","Solid","Beige","Blouses","Short top in an airy weave with narrow, tie-top shoulder straps and a small frill trim a the top."
"0797618001","Pamina WL boot","Boots","Shoes","Solid","Black","Shoes","Warm-lined boots in imitation suede with imitation leather details, and an ankle-height shaft with lacing at the front. Faux fur linings and insoles and fluted soles. Heel 4.5 cm."
"0757872002","Essie dress","Dress","Garment Full body","Sequin","Light Grey","Dresses/Skirts girls","Sleeveless dress in sequined tulle with a concealed zip at the back, seam at the waist and flared skirt in a double layer of tulle. Jersey lining."
"0894687002","Banksy Sneaker","Sneakers","Shoes","Solid","Light Beige","Shoes","Block-coloured trainers in imitation leather and imitation suede with a lightly padded edge and lacing at the front. Linings in mesh made from recycled polyester. Cotton twill insoles and patterned soles."
"0744126003","WEEKEND SWETTIS","Sweater","Garment Upper body","Front print","White","Jersey Fancy","Top in soft fabric with long sleeves and ribbing around the neckline, cuffs and hem."
"0744073001","Ariel playsuit","Trousers","Garment Lower body","All over pattern","Black","Trousers","Playsuit in an airy, patterned viscose weave with a deep V-neck, gently dropped shoulders and long, wide sleeves with elastication and a flounce at the cuffs. Wrapover top, elasticated seam at the waist with ties at the side and a second layer below the waist to form a wrapover peplum with a short flounce at the hem."
"0803624002","Mondrian Sneaker","Sneakers","Shoes","Solid","Gold","Shoes","Trainers in imitation leather with lacing at the front and a lightly padded edge and tongue. Mesh linings, fabric insoles and rubber soles."
"0633781013","Boulevard TOP PRODUCT","T-shirt","Garment Upper body","Placement print","Dark Blue","Jersey Fancy","T-shirt in soft viscose jersey with a motif on the front."
"0743128001","Leaf Flower 1p Tights","Underwear Tights","Socks & Tights","All over pattern","Off White","Socks and Tights","Leaf-patterned tights with an elasticated waist."
"0680626001","Jasper Jaquard Trapper Hat","Hat/beanie","Accessories","Jacquard","Black","Accessories","Jacquard-knit hat with earflaps, faux fur details, a sewn-in turn-up at the front and ties under the chin. Fleece lining."
"0562165001","SB P-CAP CLASSIC","Cap/peaked","Accessories","Stripe","Dark Blue","Accessories","Cap in a cotton weave with an appliqué on the front and an adjustable plastic fastener at the back."
"0696356003","P-CAP OWN","Cap/peaked","Accessories","Mixed solid/pattern","Dark Blue","Accessories","Cap with a sweatband in a cotton weave and an adjustable plastic fastener at the back."
"0738099001","Cool Expensive Necklace","Necklace","Accessories","Solid","Gold","Accessories","Necklaces in metal chains of different designs. Adjustable length 43-51 cm, 50-58 cm and 58-66 cm."
"0706371005","Jonas skirt","Skirt","Garment Lower body","Solid","Light Pink","Skirts","Short, bell-shaped skirt in imitation suede with decorative metal details on the front of the waistband, and a concealed zip at the back. Unlined."
"0693331001","JAVA trousers","Outdoor trousers","Garment Lower body","Solid","Dark Grey","Unknown","Outdoor trousers in slightly stretchy fabric with sections in water-repellent functional fabric. Elasticated waist, zip fly and button, side pockets, a zipped leg pocket and a drawstring at the hems. Unlined."
"0683622004","PICKLE jumsuit","Pyjama jumpsuit/playsuit","Nightwear","All over pattern","Other Pink","Jersey Fancy","Sleeveless playsuit in airy viscose with a print motif at the top and crossover straps at the back. Elasticated seam at the waist, side pockets and short legs."
"0613530001","CE Myrtle dress","Dress","Garment Full body","Metallic","Light Grey","Special Offers","CONSCIOUS EXCLUSIVE. Calf-length dress in a Tencel™ lyocell and silk weave containing glittery threads. Narrow cut at the top with straight, gentle draping, a high collar, gathers down the front and ties at the neck. Deep V-neck at the back and a seam at the hem with a flared skirt and slit at the front. Slightly longer at the back. Lined bodice."
"0825550001","RIHANNA DRESS","Dress","Garment Full body","Solid","Black","Jersey Fancy","Calf-length dress in soft cotton jersey with a round neckline and short sleeves. Elasticated seam and a detachable tie belt at the waist and a wrapover skirt. Unlined."
"0774075004","BROOKE PIQUE SLIM TEE","T-shirt","Garment Upper body","Solid","Light Pink","Jersey Basic","Round-necked T-shirt in soft cotton piqué."
"0900271001","HM+ Cora LS","Top","Garment Upper body","Solid","Black","Jersey Fancy","Long-sleeved top in soft viscose jersey with a V-neck and a rounded hem."
"0705348001","MARGO embroidery dress","Dress","Garment Full body","Check","Dark Blue","Woven/Jersey/Knitted mix Baby","Dress in viscose twill with embroidery at the top and buttons down the back. Short sleeves with a scalloped frill trim, a gathered seam at the top and flared skirt. Unlined."
"0752815001","LISA LINEN DRESS","Dress","Garment Full body","Solid","Dark Grey","Jersey Fancy","Calf-length, sleeveless dress in soft linen jersey with a V-neck front and back and slits in the sides."
"0664622001","Stef seamless hood","Top","Garment Upper body","Solid","Light Grey","Jersey Fancy","Running top in fast-drying, breathable functional fabric with jacquard-patterned sections and reflective details. Hood and zip at the top, and long raglan sleeves with thumbholes at the cuffs. Seamless."
"0550818001","BIRCH Relaxed shirt - check","Shirt","Garment Upper body","Check","Light Blue","Shirts","Straight-cut, checked shirt in an airy cotton-blend weave with wool and viscose. Relaxed fit with a turn-down collar, classic front and gently tapered waist. Yoke with a pleat at the back, and long sleeves with adjustable buttoning at the cuffs."
"0700946007","LEO HOOD 14.99","Hoodie","Garment Upper body","All over pattern","Light Beige","Jersey Fancy","Cropped top in lightweight, printed sweatshirt fabric. Hood with a wrapover front, low dropped shoulders and long sleeves with ribbed cuffs."
"0763665001","Nagini oversized shopper","Bag","Accessories","All over pattern","Black","Accessories","Large shopper in grained imitation leather with decorative metal details, shoulder straps and a magnetic fastener at the top. Size approx. 14.5x42x60 cm."
"0815848001","Kiev","Jacket","Garment Upper body","Solid","Black","Outdoor","Straight-cut coat in soft, stretch imitation suede with a small stand-up collar, detachable tie belt at the waist and no fasteners. Patch front pockets and raw edges at the cuffs and hem. Unlined."
"0557548002","Martha Scarf","Scarf","Accessories","Stripe","Light Beige","Accessories","Scarf in a soft weave with fringes on the short sides. Size 65x195 cm."
"0585251001","BESTIE headband","Hat/beanie","Accessories","Jacquard","Grey","Accessories","Double-layer headband in a soft jacquard knit containing glittery threads."
"0699534003","Tessan blouse","Blouse","Garment Upper body","All over pattern","Greenish Khaki","Dresses/Skirts girls","Blouse in a viscose weave with a small, lace stand-up collar, button placket and lace section at the top. Long sleeves with elasticated cuffs, and a rounded hem. Longer at the back."
"0720501001","ES Ellen shorts","Shorts","Garment Lower body","Solid","Greenish Khaki","Trousers","Shorts in stretch twill with a zip fly and button, front and back pockets and sewn-in turn-ups at the hems."
"0826498001","Fletcher","Sweater","Garment Upper body","Melange","Grey","Knitwear","Jumper in a soft, fine knit containing some wool with long puff sleeves and ribbing around the neckline, cuffs and hem. The polyester content of the jumper is recycled."
"0579010021","SWEATSHIRT AOP/RAGLAN","Sweater","Garment Upper body","Colour blocking","Red","Jersey Basic","Long-sleeved top in soft organic cotton sweatshirt fabric with a press-stud on one shoulder (no press-stud in sizes 1-4Y). Ribbing around the neckline, cuffs and hem. Soft brushed inside."
"0451380032","Bruce denim","Trousers","Garment Lower body","Denim","Light Blue","Trousers","5-pocket jeans in washed stretch denim with a regular waist, zip fly and skinny legs."
"0697175001","A-band Signe","Hair/alice band","Accessories","Solid","Dark Blue","Accessories","Fabric-covered plastic Alice band with a bow on top."
"0639332003","Disa dress","Dress","Garment Full body","Solid","Dark Turquoise","Unknown","Dress in a silk weave with a concealed zip at the back with a concealed hook-and-eye fastening at the top. Short trumpet sleeves and a tie belt at the waist. Lined."
"0384482002","Godfather slim chino","Trousers","Garment Lower body","Solid","Dark Beige","Trousers","Chinos in washed stretch cotton twill with an extended waistband, concealed hook-and-eye fastener, side pockets, and welt back pockets with a button. Slim fit."
"0588809006","PELLE fancy polo SB","T-shirt","Garment Upper body","Stripe","Green","Jersey Basic","Polo shirt in organic cotton jersey with a ribbed collar and button placket."
"0542982002","TP KEVIN sweatpants BB","Trousers","Garment Lower body","Melange","Dark Blue","Jersey Basic","Joggers in lightweight sweatshirt fabric with an elasticated drawstring waist, side pockets and ribbed hems."
"0655882001","Ponyta blazer","Blazer","Garment Upper body","All over pattern","Black","Outdoor","Jacket in a patterned crêpe weave with a detachable tie belt at the waist and long sleeves with slits at the cuffs. No fasteners. Unlined."
"0741804001","Ophelia Hipster Poppy","Underwear bottom","Underwear","Solid","White","Under-, Nightwear","Lace hipster briefs with a low waist, lined gusset and cutaway coverage at the back."
"0855471001","Reagan SS solid","Shirt","Garment Upper body","Solid","Dark Green","Shirts","Short-sleeved shirt in a cotton weave with a resort collar, French front and yoke at the back. Open chest pocket and slits in the sides."
"0651490001","Ronaldo thin hood","Hoodie","Garment Upper body","Front print","Orange","Jersey Fancy","Long-sleeved top in lightweight sweatshirt fabric with a print motif, jersey-lined hood and ribbing at the cuffs and hem."
"0747990004","Ava knitted top","Vest top","Garment Upper body","Solid","White","Knitwear","Jumper in a rib-knit viscose blend with a slight sheen. V-neck, sewn-in wrapover at the front with a large, decorative metal button, and short sleeves."
"0697112001","A-band Jilly","Hair/alice band","Accessories","Solid","Gold","Accessories","Glittery Alice band with a bow on top."
"0859125005","Hercules shirt","Shirt","Garment Upper body","Solid","Beige","Blouses","Straight-cut shirt in an airy cotton weave with a collar and buttons down the front. Gently dropped shoulders and long sleeves with buttoned cuffs. Double-layered yoke with a seam and pleat at the back, and a rounded hem. Slightly longer at the back."
"0666044002","Mistletoe highwaist thong","Underwear bottom","Underwear","Glittering/Metallic","Light Pink","Under-, Nightwear","Briefs in lace and mesh with a high, elasticated waist, lined gusset and string back."
"0630030007","Anna t-shirt","T-shirt","Garment Upper body","Solid","Light Beige","Jersey Fancy","Fitted T-shirt in stretch slub jersey made from Tencel™ lyocell."
"0573856023","Snap 5 pocket","Trousers","Garment Lower body","Treatment","Dark Blue","Trousers","5-pocket ankle-length trousers in washed stretch twill with a washed look, high waist, zip fly and slim legs."
"0739669004","IDA Set deal","Garment Set","Garment Full body","Front print","White","Jersey Fancy","Top and leggings with a print motif. Longer top in soft sweatshirt fabric with long sleeves and ribbed cuffs. Leggings in cotton jersey with an elasticated waist."
"0704132002","P-CAP 2-PACK BASIC","Cap/peaked","Accessories","Solid","Dark Grey","Accessories","Caps with an adjustable plastic fastener at the back. One cap in cotton jersey and the other in twill made from a cotton and viscose blend."
"0668012012","KIA tee","T-shirt","Garment Upper body","Solid","Light Yellow","Jersey Basic","Top in soft organic cotton jersey. Short sleeves with striped, ribbed trims."
"0234421004","Mama 200 den Tights","Underwear Tights","Socks & Tights","Solid","Dark Blue","Socks and Tights","Matt, opaque tights with extra room for a growing tummy. 200 denier."
"0849389004","Jimmy 2P shorts","Shorts","Garment Lower body","All over pattern","Dark Blue","Jersey Fancy","Shorts in soft, printed cotton jersey with covered elastication and a drawstring at the waist, and side pockets."
"0650676001","Andre fur slip in","Flat shoe","Shoes","Solid","Black","Shoes","Faux fur slides with satin linings, faux fur insoles and rubber soles."
"0738714005","SIRI hood","Top","Garment Upper body","Melange","Light Turquoise","Unknown","Sports jacket in fast-drying functional fabric with a small stand-up collar, hood, front pockets and a contrasting colour zip down the front with a chin guard."
"0864755001","Ilse 2p brazilian","Underwear bottom","Underwear","Solid","Black","Under-, Nightwear","Brazilian briefs in lace with a regular waist, lined gusset and high cut at the back."
"0887559001","Katie playful SG","Boots","Shoes","Solid","Grey","Shoes","Boots with warm faux fur linings and insoles and patterned soles."
"0498779006","Sheba maxi dress","Dress","Garment Full body","All over pattern","White","Dresses Ladies","Long, sleeveless dress in a viscose weave with narrow, adjustable shoulder straps, a V-neck with a sewn-in wrapover and a seam at the waist with ties at one side. Unlined."
"0698039001","Banjo Bolero","Cardigan","Garment Upper body","Lace","White","Knitwear","Bolero in a soft cotton pointelle knit with a decorative button at the neck and long sleeves."
"0646608001","LEGGINGS NICKI TRASH 89","Trousers","Garment Lower body","Denim","Dark Blue","Trousers Denim","Leggings in washed, superstretch denim with hard-worn details that are patched on the inside. Elasticated waist, fake front pockets and real back pockets."
"0870525003","Mia l/s","T-shirt","Garment Upper body","All over pattern","Pink","Jersey Fancy","Long-sleeved top in printed cotton jersey."
"0709230002","Boel 7-pack","Socks","Socks & Tights","Solid","Light Pink","Socks and Tights","Fine-knit socks in a soft cotton blend with elasticated tops."
"0642548002","Siri jumper","Sweater","Garment Upper body","Melange","Grey","Knitwear","Rib-knit jumper in soft cashmere with a stand-up collar, long raglan sleeves with ribbed cuffs, and a straight hem."
"0694096001","ANJA dress SET","Garment Set","Garment Full body","All over pattern","White","Woven/Jersey/Knitted mix Baby","Sleeveless dress in a patterned cotton weave with a wrapover fastening and small opening at the back, and an elasticated seam at the waist. Lined at the top. Matching hairband with a sewn-on bow at the front and covered elastication at the back."
"0527540003","Puffer X","Jacket","Garment Upper body","All over pattern","Greenish Khaki","Outdoor","Padded jacket in woven fabric with a slight sheen, stand-up collar, zip down the front and drawstring at the hem. Side pockets, one zipped arm pocket and an inner pocket with a press-stud. Polyester filling."
"0783497002","Anka dress","Dress","Garment Full body","Solid","Light Pink","Dresses Ladies","Short, straight-cut dress in woven fabric with a V-neck, long sleeves and wide cuffs with a metal button. Unlined."
"0606698001","Timo Hoodie (K)","Bra","Underwear","Application/3D","Light Yellow","Under-, Nightwear","Long top in sweatshirt fabric with a terry appliqué on the front, drawstring hood, ribbed cuffs and a raw-edge hem. Soft brushed inside."
"0657974001","Pluie rainboot SG","Other shoe","Shoes","All over pattern","Black","Shoes","Patterned, waterproof wellingtons with a high shaft, loop at the back and fluted rubber soles. Fleece lining."
"0926015005","Seamless Leggings Rib","Leggings/Tights","Garment Lower body","Solid","Dark Purple","Socks and Tights","Ribbed leggings designed with the minimum number of seams for a more comfortable fit and increased mobility."
"0777800002","Dieter ls western plaid","Shirt","Garment Upper body","Check","Dark Blue","Shirts","Shirt in soft, checked cotton twill with a turn-down collar, classic front with press-studs, and a yoke at the back. Flap chest pockets with a press-stud, and long sleeves with buttoned cuffs."
"0886189001","Vintage slim trash","Trousers","Garment Lower body","Denim","Light Grey","Trousers Denim","5-pocket, ankle-length jeans in washed denim with hard-worn details. Extra-high waist, a zip fly and button, and slim legs. The cotton content of the jeans is partly recycled."
"0649059001","Atlanta Hipster Ch. Poppy Mid","Underwear bottom","Underwear","Solid","Light Beige","Under-, Nightwear","Hipster briefs in microfibre and lace with a mid waist, lined gusset, narrow sides and cutaway coverage at the back."
"0905122001","Aubergine Linen","Blouse","Garment Upper body","All over pattern","Off White","Blouses","Fitted top in airy linen with a sweetheart neckline, flounced, elastic shoulder straps and a smocked back."
"0831969001","C PIRATE Dress","Dress","Garment Full body","Mixed solid/pattern","Red","Special Offers","Pirate dress in stretch velour with a glittery motif on the front, a deep neckline and short, elasticated puff sleeves with a frill trim. Detachable elastic belt with a plastic buckle at the waist, a concealed zip in one side and an asymmetric skirt in satin and tulle. Unlined."
"0699325003","Sunglasses Tess","Sunglasses","Accessories","Solid","Pink","Accessories","Aviator-style sunglasses with metal and plastic frames and tinted, UV-protective lenses."
"0795550002","Linda Sidestripe Slim HW DNM","Trousers","Garment Lower body","Metallic","Black","Trousers","Jeans in washed, stretch denim with a high waist, zip fly and button, back pockets and slim legs reversible sequin side stripes."
"0663441001","Luna strappy padded soft bra","Bra","Underwear","Lace","Dark Red","Under-, Nightwear","Soft, non-wired bra in lace with moulded, lightly padded cups that give the bust a natural shape and light support. Narrow elastic straps that cross at the front and narrow adjustable shoulder straps. Wide hook-and-eye fastening at the back with three pairs of hooks and eyes and a lace trim at the hem."
"0880485005","ALFIE COAT","Coat","Garment Upper body","Melange","Dark Beige","Outdoor","Coat in a soft, felted wool blend containing some cashmere. Notch lapels with a decorative buttonhole and buttons down the front. One chest pocket, flap front pockets, two inner pockets, and a single back vent. Twill lining made from recycled polyester. The wool content of the coat is recycled."
"0678821004","Wave Sweater","Sweater","Garment Upper body","Colour blocking","Blue","Knitwear","Block-coloured jumper in a soft rib knit with low dropped shoulders, long sleeves and ribbing around the neckline, cuffs and hem."
"0929001001","True","Dress","Garment Full body","Solid","Green","Dresses Ladies","Calf-length dress in a crinkled weave with a small stand-up collar, covered buttons at the top, wide, raglan sleeves and cuffs with covered buttons. Gathered seam at the waist and a softly draping, A-line skirt. Unlined."
"0485678055","TP Sixten 3-p boxer BB","Underwear bottom","Underwear","Solid","Greenish Khaki","Under-, Nightwear","Boxer shorts in organic cotton jersey with short legs, an elasticated waist and lined front."
"0560616001","Reese boots","Socks","Socks & Tights","Other pattern","Grey","Socks and Tights","Slippers in a soft knit with faux fur linings and insoles and knitted soles with anti-slip protectors."
"0594167002","OL BAZE Slipper","Sandals","Shoes","Solid","Black","Shoes","Faux fur mules with insoles and fluted rubber soles."
"0815738003","FIA frill","Top","Garment Upper body","Metallic","Dark Red","Jersey Basic","Top in soft jersey made from a cotton blend containing glittery threads. Dropped shoulders with a flounced trim and long sleeves. The cotton content of the top is organic."
"0756099004","Pinnochio Beanie","Hat/beanie","Accessories","Solid","Yellowish Brown","Accessories","Hat in a soft, cable knit with a faux fur pompom on top and a sewn-in turn-up at the hem."
"0567725003","Marco scuba shoe","Sandals","Shoes","Solid","Light Blue","Shoes","Aqua shoes in scuba fabric with elastication around the top, a loop at the back and textured rubber soles."
"0558817001","SUPREME CROPPED BASIC TIGHTS","Trousers","Garment Lower body","Melange","Dark Grey","Unknown","Sports tights in fast-drying functional fabric with a contrasting colour elasticated waistband and 3/4-length legs."
"0590361001","Speed coat","Coat","Garment Upper body","Solid","Black","Unknown","Double-breasted coat in a woven cotton blend with wide notch lapels, a decorative button hole and an off-centre zip and buttons down the front. Long sleeves with a tab and press-stud, and flap side pockets with a press-stud. Unlined."
"0617835003","DIV Maja cardigan","Sweater","Garment Upper body","Solid","Pink","Unknown","Long cardigan in a soft, fine loose knit with slits at the hem and no fasteners. The polyester content of the cardigan is recycled."
"0764536001","Linn Slim HW Sidetape","Trousers","Garment Lower body","Application/3D","Blue","Trousers","Ankle-length jeans in washed, stretch twill with a high waist, zip fly and button, back pockets and skinny legs with stripes down the sides."
"0719541002","Olivia off-shoulder tee","T-shirt","Garment Upper body","Solid","White","Jersey Basic","Cropped, off-the-shoulder top in soft jersey with a concealed silicone trim and short sleeves. Overlocked edge around the top, sleeves and hem."
