"article_id","prod_name","product_type_name","product_group_name","graphical_appearance_name","colour_group_name","garment_group_name","detail_desc"
"0695255001","Siv t-shirt","T-shirt","Garment Upper body","All over pattern","Dark Blue","Jersey Fancy","Short-sleeved top in soft viscose jersey with a unique nursing feature. The design includes a double layer at the top to help retain warmth while allowing easier nursing access."
"0821115007","RICHIE SKIRT","Skirt","Garment Lower body","Check","Pink","Skirts","Short, pleated skirt in woven fabric with a high waist and concealed zip and press-stud at one side. Unlined."
"0553238008","THORN LS TEE","Sweater","Garment Upper body","Solid","White","Jersey Basic","Wide, long-sleeved top in soft cotton jersey with an open chest pocket, ribbing around the neckline and short slits in the sides. Loose fit."
"0627147001","Bling Me Up Push","Bikini top","Swimwear","Lace","Dark Red","Swimwear","Fully lined bikini top with hole-patterned, underwired, moulded, padded cups that lift and shape, and ties at the back of the neck."
"0794520001","Plus seam at back 1p tights","Underwear Tights","Socks & Tights","Solid","Black","Socks and Tights","Tights with a seam down the back of the legs. 30 denier."
"0697564030","KELLY SHIRT S.0","Shirt","Garment Upper body","Stripe","Blue","Blouses","Shirt in airy cotton with a collar, buttons down the front, long sleeves with buttoned cuffs, and a rounded hem."
"0698715001","Emma Fancy Slipon SG","Sneakers","Shoes","Placement print","Light Pink","Shoes","Slip-on trainers in cotton canvas with a print motif and sequins. Glittery elastic gores in the sides and a loop at the back. Contrasting colour canvas linings and insoles and rubber soles."
"0526562001","Sonny jogger","Trousers","Garment Lower body","Solid","Black","Trousers","Pull-on trousers in stretch cotton twill with an elasticated drawstring waist, fake fly, side pockets and fake back pockets. Tapered legs with gathers below the knees and a zip at the hems."
"0649099001","Polkagris","Shorts","Garment Lower body","Stripe","Red","Shorts","Shorts in a viscose and cotton weave containing some linen with a high paper bag waist and fly with a concealed zip. Pleats at the top, a detachable tie belt, side pockets and short legs with sewn-in turn-ups. Unlined."
"0762061003","2P S/J pants","Trousers","Garment Lower body","All over pattern","Light Turquoise","Jersey Basic","Trousers in soft organic cotton jersey with an elasticated drawstring waist."
"0646152001","ES Mia tee","T-shirt","Garment Upper body","Solid","White","Jersey Fancy","Fitted T-shirt in airy cotton jersey."
"0767228003","FASHION OFFER GRAYHAM  SET","Garment Set","Garment Full body","Placement print","Dark Orange","Jersey Fancy","Set with a top in lightweight sweatshirt fabric and pair of leggings in soft jersey. Printed top with press-studs on one shoulder. Leggings with an elasticated waist and ribbed hems."
"0786347001","Katie","Dress","Garment Full body","Solid","Black","Jersey Basic","Straight-cut dress in ribbed jersey with a turtle neck and long sleeves."
"0564310012","Anthony 3pk  Fancy","Underwear bottom","Underwear","All over pattern","Light Pink","Under-, Nightwear","Trunks in stretch cotton jersey with flatlock seams, short legs, an elasticated waist and a lined front."
"0819758001","ROXO REGULAR CREW","Sweater","Garment Upper body","Placement print","Black","Jersey Fancy","Long-sleeved top in sturdy, printed jersey with a round neckline and ribbing at the cuffs and hem."
"0558825002","APRIL SHIRT S.7","Shirt","Garment Upper body","Check","Light Orange","Blouses","Long shirt in an airy viscose weave with a collar, buttons down the front and chest pocket. Long sleeves with buttoned cuffs and a rounded hem with slits in the sides. Slightly longer at the back."
"0783707070","1pk Fun","Socks","Socks & Tights","All over pattern","Orange","Socks and Tights","Socks in a soft, jacquard-knit cotton blend with elasticated tops."
"0738401001","PE MAJ DRESS","Dress","Garment Full body","All over pattern","White","Unknown","Calf-length dress in a snakeskin-patterned, airy weave with a draped front and decorative wrapover detail at the top. Long sleeves with a width that creates an asymmetric finish, draping with a sewn-in wrapover at the back, a seam at the waist and draped skirt with a slit at the front. Concealed zip in one side. Lined skirt."
"0772324004","Wippet blazer","Blazer","Garment Upper body","Solid","Dark Green","Dressed","Jacket in woven fabric with a sheen. Shawl collar, concealed pockets in the side seams, 3/4-length sleeves with gathers at the cuffs, and a tie belt at the waist. No fasteners. Lined."
"0709902001","Shanta Shorts","Shorts","Garment Lower body","Lace","Dark Blue","Trousers","Shorts in stretch twill with an adjustable elasticated waist, zip fly and press-stud, front and back pockets and a lace trim at the hems."
"0664715001","Cable tights","Underwear Tights","Socks & Tights","Solid","Off White","Socks and Tights","Tights in a soft, cable-knit cotton blend with an elasticated waist."
"0591800001","Lime bikini hipster BIG","Swimwear bottom","Swimwear","Solid","Black","Swimwear","Fully lined bikini bottoms with a mid waist and laser-cut scalloped edges."
"0681891001","ED Roman blouse","Top","Garment Upper body","Solid","Pink","Blouses","Blouse in airy chiffon crêpe with embroidery, a V-neck with buttons at the front and a stand-up collar with a small frill. Frill at the front that continues over the shoulders, long sleeves with a wide flounce at the cuffs, and a wide flounce at the hem. Unlined."
"0536952001","Hamza","Top","Garment Upper body","Solid","Black","Jersey Fancy","Fitted jersey top with a heart-shaped neckline and long sleeves."
"0559069004","MY hood","Hoodie","Garment Upper body","Melange","Blue","Knitwear","Fine-knit hooded jumper in a soft viscose blend with a motif on the front, long sleeves with gathered seams, and a drawstring at the hem."
"0606083005","Leona long dress","Dress","Garment Full body","All over pattern","Black","Jersey Fancy","Long dress in patterned viscose jersey with smocking at the top and narrow shoulder straps."
"0891890005","TORONTO regular crew","Sweater","Garment Upper body","Front print","Light Grey","Jersey Fancy","Long-sleeved top in sweatshirt fabric with a soft brushed inside. Ribbing around the neckline, cuffs and hem."
"0344956011","Flirty Romi waterbottle","Other accessories","Accessories","All over pattern","White","Accessories","Plastic water bottle with a screw top and practical wrist strap that also holds the top in place. Capacity 550 ml."
"0754018002","Relaxed tap basic 89","Trousers","Garment Lower body","Denim","Black","Trousers Denim","5-pocket jeans in washed, stretch denim in a relaxed fit with an adjustable, elasticated waist, zip fly and button and tapered legs."
"0853006001","Lily NEW SL (W)","Pyjama set","Nightwear","All over pattern","Black","Under-, Nightwear","Pyjamas with a strappy top and pair of shorts in patterned satin. Top with adjustable spaghetti shoulder straps. Shorts with covered elastication and a frill trim at the waist."
"0858037001","Ohoj shorts","Shorts","Garment Lower body","Solid","Dark Blue","Trousers","High-waisted shorts in woven fabric with decorative buttons at the front. Zip fly with a hook-and-eye fastener, and fake welt pockets at the back."
"0659453002","Palme Parka","Coat","Garment Upper body","Solid","Dark Green","Outdoor","Short, lightly padded parka in washed cotton twill with a collar with a detachable faux fur trim and a zip and wind flap with concealed press-studs down the front. Chest pockets and front pockets with a flap and concealed press-stud, a concealed drawstring at the waist and hem, and a tab with a hook and loop fastener at the cuffs. Lined."
"0892427001","Flirty Moonlight bracelet pk","Bracelet","Accessories","Solid","Light Pink","Accessories","Bracelets in different designs of thin metal chains. Adjustable length, approx. 19-26 cm."
"0564988007","BRENDA bomber","Jacket","Garment Upper body","Solid","Dark Blue","Outdoor","Padded bomber jacket in woven fabric with a slight sheen. Small, ribbed stand-up collar, zip down the front, flap side pockets with a press-stud and a gathered seam at the back and down the sleeves. Ribbing at the cuffs and hem. Lined."
"0621915002","Jupiter Sandal","Sandals","Shoes","Solid","Yellowish Brown","Shoes","Low, imitation leather sandals with an elasticated heel strap. Rubber insoles and soles."
"0501436007","Alex","Sweater","Garment Upper body","Melange","Dark Grey","Knitwear","Fine-knit V-neck jumper in a soft viscose blend in a straight style with long sleeves and slits in the sides. Slightly longer at the back."
"0547863001","Gift","Dress","Garment Full body","All over pattern","Black","Dresses Ladies","Dress in a patterned crêpe weave with a low stand-up collar, buttons down the front, some of which are concealed, a gathered yoke at the back, long sleeves with buttoned cuffs and a rounded hem. Slightly longer at the back. Unlined."
"0661755001","CC MIA trousers BG","Trousers","Garment Lower body","Melange","Dark Red","Jersey Basic","Joggers in soft sweatshirt fabric with an elasticated waist and legs with stripes down the sides and ribbed hems. Soft brushed inside. The cotton content of the joggers is partly recycled."
"0538458002","Ina","Sweater","Garment Upper body","Melange","Dark Grey","Knitwear","Jumper in fine-knit merino wool with a V-neck, dropped shoulders and ribbing around the neckline, cuffs and hem."
"0648339001","DIV Mel maxi dress","Dress","Garment Full body","All over pattern","Blue","Blouses","Maxi dress in woven fabric with a V-neck and narrow shoulder straps. Elasticated seam at the waist and a straight-cut, softly draping skirt with high slits in the sides."
"0617303001","Able WCT pants","Trousers","Garment Lower body","Solid","Black","Jersey Fancy","Joggers with an elasticated drawstring waist, side pockets and contrasting colour stripes down legs."
"0854092002","PQ ROLEX LINEN TEE","T-shirt","Garment Upper body","Solid","Light Beige","Knitwear","T-shirt in slub linen jersey with a low-cut neckline."
"0923168002","Felicia cord","Shirt","Garment Upper body","Solid","Beige","Blouses","Straight-cut shirt in heavy cotton corduroy with a collar, buttons down the front, a yoke at the back, a rounded hem and long sleeves with buttoned cuffs."
"0797892002","ED Milk slaks","Trousers","Garment Lower body","Solid","Light Beige","Trousers","Cigarette trousers in stretch twill with a regular waist that is elasticated at the back. Fake fly, diagonal side pockets, fake welt back pockets and ankle-length legs with creases."
"0411974005","OL BLIXTEN PQ sneaker","Sneakers","Shoes","Solid","Light Grey","Shoes","Trainers with lacing at the front, mesh linings, cotton twill insoles and rubber soles."
"0625779004","Cherry playsuit","Trousers","Garment Lower body","All over pattern","Dark Orange","Jersey Fancy","Sleeveless playsuit in viscose jersey with a V-neck front and back and narrow shoulder straps. Elasticated seam at the waist with decorative twisted ties with tassels, and short, wide legs."
"0715862004","BARRY BURN OUT HENLEY","Sweater","Garment Upper body","Treatment","Dark Green","Jersey Fancy","Henley shirt in slub jersey with a button placket and long sleeves with a tab and button."
"0852552001","CE - Manon hairpin V6","Hair clip","Accessories","Glittering/Metallic","Gold","Special Offers","CONSCIOUS EXCLUSIVE. Coral-shaped hair pin made partly from recycled metal decorated with faceted glass rhinestones. Length approx. 15 cm."
"0889575001","Johan rollerneck","Sweater","Garment Upper body","Melange","Black","Knitwear","Polo-neck jumper in a cotton knit with long sleeves and ribbing at the cuffs and hem."
"0696896001","Una Tee","T-shirt","Garment Upper body","Placement print","Dark Grey","Unknown","Wide-fitting sports top in fast-drying functional fabric with a print motif on the front, short cap sleeves and a rounded hem."
"0808662002","Noor PQ sandal","Sandals","Shoes","All over pattern","Yellow","Shoes","Slides with wide, crossover straps at the front. The top strap is adjustable and has a round covered metal buckle. Leather insoles and rubber soles."
"0456163021","Woody (1)","Hoodie","Garment Upper body","Solid","Blue","Jersey Basic","Wide top in sweatshirt fabric with a lined drawstring hood, kangaroo pocket and ribbing at the cuffs and hem."
"0866657001","Ellen 3p bikini","Underwear bottom","Underwear","Solid","Black","Under-, Nightwear","Bikini briefs in soft, organic cotton jersey with a mid waist, lined gusset and medium coverage at the back."
"0535388004","Cotton eye shirt","Shirt","Garment Upper body","Solid","Dark Grey","Dresses Ladies","Wide shirt in a soft weave with a collar, button placket, dropped shoulders, long sleeves and buttoned cuffs. Yoke with a pleat at the back, and a rounded hem with slits in the sides. Longer at the back."
"0688771001","Flirty Heart Bride aliceband","Hair/alice band","Accessories","Solid","Gold","Accessories","Satin-covered Alice band with glittery appliqués on the top."
"0641891001","Joffrey bomber","Jacket","Garment Upper body","Solid","Black","Outdoor","Padded bomber jacket in woven fabric with a slight sheen. Small, ribbed stand-up collar, zip down the front, side pockets and ribbing at the cuffs and hem. Lined."
"0599521001","Studio 55 Top","Top","Garment Upper body","Application/3D","Black","Dresses Ladies","Backless jersey top with small round studs and ties at the neck and hem."
"0669710003","SPARKLING TANK","Vest top","Garment Upper body","Glittering/Metallic","Black","Blouses","Pleated top in woven fabric containing glittery threads in a narrow cut at the top with short, narrow shoulder straps, and a faceted button at the back. Lined."
"0630851005","BEANIE KNIT MALTE LATE","Hat/beanie","Accessories","Stripe","Dark Orange","Accessories","Hat in a soft knit with a pompom on the top and earflaps. Fleece lining."
"0840607003","Nicole","Blouse","Garment Upper body","All over pattern","Light Beige","Blouses","Fitted top in a linen and viscose weave with a sweetheart neckline and short puff sleeves with elastication at the shoulders and hems."
"0711823006","Shorts HW Pixie","Shorts","Garment Lower body","Denim","Light Yellow","Trousers Denim","High-waisted shorts in washed, stretch denim with a zip fly and button, fake front pockets, real back pockets and short slits in the sides."
"0898378003","Belmont cargo","Trousers","Garment Lower body","Solid","Dark Blue","Trousers","Ankle-length trousers woven in a viscose blend with covered elastication and a concealed drawstring at the waist and a fake fly. Diagonal side pockets, welt back pockets and legs with creases and easy-access flap pockets."
"0574109015","Rachel Basic L/S","Sweater","Garment Upper body","Solid","Red","Knitwear","Fitted top in a fine rib knit with long sleeves and a ribbed neckline."
"0648878001","AK Hennessy zip","Hoodie","Garment Upper body","Solid","Beige","Special Offers","Short jacket in scuba fabric with a jersey-lined drawstring hood, zip down the front, front pockets and long raglan sleeves with wide ribbing and a thumbhole at the cuffs."
"0851094005","Mist Conscious Rib Tank","Vest top","Garment Upper body","Solid","Red","Jersey Fancy","Sports vest top in ribbed fast-drying functional fabric made from recycled polyester with short slits in the sides. Longer at the back."
"0652031001","Peggy pearl earring pack","Earring","Accessories","Solid","Off White","Accessories","Metal earrings with plastic beads in various sizes."
"0567803001","Utah cardigan","Cardigan","Garment Upper body","All over pattern","Dark Blue","Knitwear","Patterned, fine-knit cardigan in soft cotton with a round neck, buttons down the front and ribbing at the neckline, cuffs and hem."
"0680404001","Push Scarf","Scarf","Accessories","All over pattern","Dark Pink","Accessories","Scarf in an airy patterned weave."
"0695322004","LANCE STRIPED SHIRT","Shirt","Garment Upper body","Stripe","Black","Shirts","Shirt in cotton twill with a button-down collar with concealed buttons, a classic front and yoke at the back. Long sleeves with adjustable buttoning at the cuffs, and a rounded hem. Regular Fit – a classic fit with good room for movement and a gently tapered waist to create a comfortable, tailored silhouette."
"0820541001","Cortardo body ol","Top","Garment Upper body","Lace","Black","Jersey Fancy","Fitted body in sturdy, ribbed jersey with a sheen. V-neck, decorative, crossover lace straps at the front and press-studs at the crotch."
"0669552002","Nutella Hipster Peoni Low","Underwear bottom","Underwear","Solid","Black","Under-, Nightwear","Hipster briefs in lace with a low waist, lined gusset, wide sides and cutaway coverage at the back."
"0842000003","Shelly Polo Neck","Sweater","Garment Upper body","Solid","White","Knitwear","Fitted jumper in a soft, rib-knit viscose blend with a polo neck, long sleeves and short slits in the sides."
"0746310005","BRUCE CREWNECK","Sweater","Garment Upper body","Colour blocking","Dark Blue","Jersey Fancy","Long-sleeved top in soft sweatshirt fabric with ribbing around the neckline, cuffs and hem. Soft brushed inside."
"0796823001","Hilly cheeky super high","Underwear bottom","Underwear","Solid","Black","Under-, Nightwear","Shaping briefs in microfibre with a high waist, lined gusset and laser-cut edges. The briefs have a light sculpting effect on the waist, bum and hips."
"0738777002","PE SAN REMO TOP","Top","Garment Upper body","Solid","Light Orange","Unknown","Top in soft, fine-knit cotton with a V-neck front and back and a narrow cut at the top."
"0657168002","Misha l/s top Halloween","T-shirt","Garment Upper body","Front print","Grey","Jersey Fancy","Long-sleeved top in cotton jersey with a glow-in-the-dark print on the front and a gently rounded hem. Slightly longer at the back."
"0749827001","MILAD fleece","Jacket","Garment Upper body","All over pattern","Grey","Outdoor","Jacket in soft fleece designed to be worn as a thermal mid layer with a stand-up collar, zip down the front with a chin guard, and long raglan sleeves. Unlined. The jacket is made partly from recycled polyester."
"0745306001","EDC Agge dress","Dress","Garment Full body","All over pattern","White","Special Offers","Calf-length dress in an airy Tencel™ lyocell and viscose weave with a V-shaped opening and concealed buttons at the front. Gathered yoke, long balloon sleeves with narrow cuffs, a seam at the hips and wide, gathered skirt with an asymmetric hem. Unlined."
"0759218001","Kalle tee","T-shirt","Garment Upper body","Colour blocking","Yellow","Jersey Fancy","Block-patterned T-shirt in printed cotton jersey."
"0910494002","ELLA DRESS","Dress","Garment Full body","Denim","Black","Dresses Ladies","Short, fitted dress in stretch denim with a square neckline, covered elastication over the shoulders and short puff sleeves. Unlined."
"0878045003","Tobias Henley tee","T-shirt","Garment Upper body","Solid","Dark Blue","Jersey Fancy","Short-sleeved Henley shirt in soft slub cotton jersey with a narrow trim around the neckline, button placket and small fabric appliqué at the hem."
"0538993001","Bones utility trousers HW","Trousers","Garment Lower body","Solid","Greenish Khaki","Trousers","High-waisted trousers in woven fabric with a detachable tie belt, pleats and the top and a zip in the side. Zip fly with hook and eye fasteners, side pockets, fake back pockets and wide tapered legs."
"0294076007","Skinny Shaping","Trousers","Garment Lower body","Solid","Black","Trousers","Shaping. Jeans in washed denim with technical stretch that holds in and shapes the hips, thighs and seat while keeping the jeans in shape. Fake front pockets, real back pockets and skinny legs. Wide ribbing at the waist for optimum comfort."
"0687173003","Margarita Push Melbourne","Bra","Underwear","Solid","Light Pink","Under-, Nightwear","Lace push-up bra with moulded, padded cups for a larger bust and fuller cleavage. Narrow, adjustable shoulder straps and a hook-and-eye fastening at the back."
"0872538003","River cargo jogger pullon TP","Trousers","Garment Lower body","Solid","Greenish Khaki","Trousers","Cargo joggers in washed cotton canvas. Casual style in a relaxed fit with covered elastication and a drawstring at the waist and a fake fly. Diagonal side pockets, fake back pockets with a flap, and bellows pockets with a flap on the legs. Tapered legs with shaping seams at the knees."
"0563459001","Ziggy velvet body v.5","Underwear body","Underwear","Solid","Black","Under-, Nightwear","Velour body with a wide flounce at the top and detachable, adjustable shoulder straps. Lined crotch with press-studs."
"0637996004","Esther set","Hat/beanie","Accessories","Solid","White","Accessories","Set with a hat and mittens in a soft cable knit containing some wool. Hat with a faux fur pompom on top, earflaps and ties under the chin. Mittens with foldover ribbing. Both hat and mittens have a fleece lining."
"0895010002","Func. Hector HT SG","Sneakers","Shoes","Solid","Light Pink","Shoes","Waterproof hi-tops in imitation leather with a padded edge and tongue, elasticated lacing at the front and a hook and loop tab at the top. Loop at the front and back and chunky, patterned soles. Height of soles 2.3 cm."
"0889574006","Evelina Dress L/S","Dress","Garment Full body","Dot","Yellow","Jersey Fancy","Long-sleeved dress in soft cotton jersey with overlocked frill trims at the front and a concealed press-stud on one shoulder (except in sizes 1½-4Y). Gathered seam at the top and a flared skirt."
"0890319001","SAGA SPORT s.9 bikini","Swimwear set","Swimwear","All over pattern","Other Yellow","Swimwear","Fully lined bikini. Top with wide shoulder straps and a racer back with a cut-out section and wide elastic hem. Bottoms with a wide elastic waistband."
"0700010001","Sigrid sport swimsuit","Swimsuit","Swimwear","Front print","Light Turquoise","Swimwear","Fully lined swimsuit with a text print on the front, racer back and cut-out section at the back."
"0873884005","Lee PU mini","Skirt","Garment Lower body","Treatment","Black","Skirts","Short skirt in imitation leather with a high waist and a concealed zip at the back. Lined. The polyurethane content of the skirt is water-based and free from DMF."
"0713378001","Karl","Sweater","Garment Upper body","Check","Beige","Knitwear","Oversized jumper in a jacquard knit containing some wool with ribbing around the neckline, cuffs and hem."
"0754267016","Zebra- TVP- TM","Sweater","Garment Upper body","Front print","Red","Jersey Fancy","Top in lightweight sweatshirt fabric with dropped shoulders, long sleeves and ribbing around the neckline, cuffs and hem."
"0829302002","Pingu spring","Sweater","Garment Upper body","Solid","Black","Jersey Fancy","Top in a relaxed fit with long dolman sleeves."
"0705543001","Pria PLUSSIZE","T-shirt","Garment Upper body","Front print","Light Green","Jersey Fancy","T-shirt in soft cotton jersey with a print motif, round neckline, short sleeves and a rounded hem."
"0728703008","PQ Icona beanie","Hat/beanie","Accessories","Solid","Light Beige","Accessories","Hat knitted in soft cashmere with a roll edge."
"0758353001","PE CATHARINE TROUSER","Trousers","Garment Lower body","Solid","Black","Unknown","Trousers in a sturdy Tencel™ lyocell and silk weave with a sheen. High waist, concealed hook-and-eye fastening, zip fly, diagonal side pockets, a welt back pocket and gently tapered legs with creases."
"0584187001","Thierry Bomber","Cardigan","Garment Upper body","Treatment","Black","Jersey Fancy","Long-sleeved cardigan in soft sweatshirt fabric with a decorative detail on the chest, flap pocket on one sleeve, side pockets and ribbing around the neckline, cuffs and hem."
"0595696030","Margarita Pull- On Shorts","Shorts","Garment Lower body","All over pattern","White","Shorts","Short shorts in a viscose weave with an elasticated drawstring waist, side pockets and gently rounded hems with short slits in the sides."
"0857453005","JONES SLIM 5PKT","Shorts","Garment Lower body","Solid","Dark Blue","Shorts","5-pocket shorts in cotton twill with a regular waist, slightly lower crotch and zip fly and button."
"0384851019","Sage Shorts","Shorts","Garment Lower body","Solid","Dark Pink","Jersey Basic","Short shorts in sweatshirt fabric with an elasticated drawstring waist, back pocket and contrasting colour trims."
"0901679001","Togepi tunic","Blouse","Garment Upper body","Solid","Light Blue","Blouses","Tunic in crisp cotton seersucker with an opening and button at the back of the neck, dropped shoulders and short, voluminous puff sleeves. Seam with a drawstring under the bust and at the back. Lined with a detachable, V-neck inner top in a viscose weave. The inner top has narrow, adjustable shoulder straps."
"0654870002","KAYLA shorts","Shorts","Garment Lower body","Placement print","Other Pink","Jersey Fancy","Shorts in lightweight sweatshirt fabric with an elasticated drawstring waist, side pockets, print on one leg and sewn-in turn-ups at the hems."
"0554541014","SKINNY SS 89","Trousers","Garment Lower body","Denim","Light Blue","Trousers Denim","5-pocket slim-fit jeans in washed, superstretch, flexible denim for maximum mobility with an adjustable, elasticated waist, zip fly and narrow hems."
"0593030001","Mya Lace 1p Tights","Underwear Tights","Socks & Tights","Lace","Light Beige","Socks and Tights","Lace tights with an elasticated waist."
"0488012012","TP Axel 5-p anklesock BB","Socks","Socks & Tights","Stripe","Green","Socks and Tights","Jacquard-knit socks in a soft cotton blend with elastication around the top."
"0938303001","HW spidy aliceband","Hair/alice band","Accessories","Solid","Black","Accessories","Narrow Alice band in metal with a large glittery cobweb on top resembling a tiara."
